{
  "$schema": "https://json-schema.org/draft/2020-12/schema",
  "$id": "https://debark.dev/schema/doctorreport/v1",
  "title": "debark doctor report v1",
  "description": "debark.doctorreport/v1 - what is likely to go wrong on the far side of the gap: maintainer scripts that want the network, snap shim packages, DKMS packages without matching headers, and redistribution terms. Emitted by `debark doctor --json`. Every finding is a heuristic and says so: wording is deliberately \"no obvious network action found\", never \"proven safe\". doctor never fails a build by itself; policy does that.",
  "type": "object",
  "additionalProperties": false,
  "required": ["schema_version", "checked_at", "findings", "scanned"],
  "properties": {
    "schema_version": { "const": "debark.doctorreport/v1", "description": "Fixed schema identifier; always debark.doctorreport/v1." },
    "checked_at": {
      "type": "string",
      "format": "date-time",
      "pattern": "^[0-9]{4}-[0-9]{2}-[0-9]{2}T[0-9]{2}:[0-9]{2}:[0-9]{2}Z$",
      "description": "When this report was produced, RFC 3339 UTC, second precision."
    },
    "findings": {
      "type": "array",
      "items": { "$ref": "#/$defs/Finding" },
      "description": "Every observation from this run."
    },
    "scanned": { "type": "integer", "minimum": 0, "description": "Number of packages actually examined." },
    "summary": {
      "type": "object",
      "additionalProperties": { "type": "integer", "minimum": 0 },
      "description": "Finding counts keyed by severity, for a one-line human summary. Deliberately open-ended: keys are the severities actually seen."
    }
  },
  "$defs": {
    "Finding": {
      "type": "object",
      "additionalProperties": false,
      "required": ["check", "severity", "message"],
      "properties": {
        "check": {
          "type": "string",
          "enum": ["network-postinst", "snap-shim", "dkms-headers", "redistribution", "unverified-url", "held-package", "essential-change"],
          "description": "Which heuristic produced this finding. Stable: scripts and policy files reference these identifiers."
        },
        "severity": {
          "type": "string",
          "enum": ["note", "warn"],
          "description": "doctor's own severity scale. Distinct from policy severity, which additionally has \"deny\"."
        },
        "package": { "type": "string", "description": "Package this finding is about, when it is about one package." },
        "version": { "type": "string", "description": "Version of that package." },
        "message": { "type": "string", "description": "Human-readable sentence." },
        "evidence": { "type": "string", "description": "The concrete thing that triggered this finding: a matched script line, a component name, a missing header package name." },
        "flag": {
          "type": "string",
          "enum": ["multiverse", "restricted", "non-free", "non-free-firmware", "network-postinst", "snap-shim", "dkms", "user-supplied"],
          "description": "The lock flag this finding corresponds to, when there is a matching one."
        }
      }
    }
  }
}
